{
  "schema_version": "1",
  "artifact_type": "plan",
  "plan": {
    "id": "FS0-CORE-PLAN",
    "title": "FS0-Core Implementation Plan",
    "description": "Atomic redistillation of the isolated FS0-Core target-state implementation contract under the accepted Governance normative-statement contract. Each normative identity now represents one independently governable rule."
  },
  "functional_set": {
    "id": "FS0-CORE",
    "path": "repo/bootstrap/data/plan/000_FS0-CORE/functional-set.json"
  },
  "implementation_predecessor": {
    "repository_revision": "65b6477dc3ed10cd6ebb83e83653e995f63b47fd"
  },
  "normative_requirements": [
    {
      "id": "FS0-NR-001",
      "statement": "The repository framework SHALL treat maintained Markdown Design Proposals as the canonical Design semantic source.",
      "evaluation": {
        "conformance": {
          "applicability": "required"
        },
        "assurance": {
          "applicability": "required"
        }
      }
    },
    {
      "id": "FS0-NR-002",
      "statement": "Each consumed Design Proposal SHALL declare a valid stable `DP-NNN` document identity.",
      "evaluation": {
        "conformance": {
          "applicability": "required"
        },
        "assurance": {
          "applicability": "none",
          "rationale": "The obligation is mechanically decidable under the accepted normative-statement contract."
        }
      }
    },
    {
      "id": "FS0-NR-003",
      "statement": "Each consumed Design Proposal SHALL conform to the canonical top-level section structure.",
      "evaluation": {
        "conformance": {
          "applicability": "required"
        },
        "assurance": {
          "applicability": "none",
          "rationale": "The obligation is mechanically decidable under the accepted normative-statement contract."
        }
      }
    },
    {
      "id": "FS0-NR-004",
      "statement": "Each consumed Design Proposal SHALL declare stable section identities.",
      "evaluation": {
        "conformance": {
          "applicability": "required"
        },
        "assurance": {
          "applicability": "none",
          "rationale": "The obligation is mechanically decidable under the accepted normative-statement contract."
        }
      }
    },
    {
      "id": "FS0-NR-005",
      "statement": "Each consumed Design Proposal SHALL contain valid unique Design statement identities.",
      "evaluation": {
        "conformance": {
          "applicability": "required"
        },
        "assurance": {
          "applicability": "none",
          "rationale": "The obligation is mechanically decidable under the accepted normative-statement contract."
        }
      }
    },
    {
      "id": "FS0-NR-006",
      "statement": "Each functional set SHALL bind every consumed Design Proposal to an exact repository revision.",
      "evaluation": {
        "conformance": {
          "applicability": "required"
        },
        "assurance": {
          "applicability": "none",
          "rationale": "The obligation is mechanically decidable under the accepted normative-statement contract."
        }
      }
    },
    {
      "id": "FS0-NR-007",
      "statement": "Each Plan SHALL preserve the exact Design Proposal revision bindings declared by its functional set.",
      "evaluation": {
        "conformance": {
          "applicability": "required"
        },
        "assurance": {
          "applicability": "none",
          "rationale": "The obligation is mechanically decidable under the accepted normative-statement contract."
        }
      }
    },
    {
      "id": "FS0-NR-008",
      "statement": "A later Design Proposal revision SHALL NOT silently alter an accepted Plan.",
      "evaluation": {
        "conformance": {
          "applicability": "required"
        },
        "assurance": {
          "applicability": "required"
        }
      }
    },
    {
      "id": "FS0-NR-009",
      "statement": "A Design statement identity SHALL serve only as an address into Design.",
      "evaluation": {
        "conformance": {
          "applicability": "required"
        },
        "assurance": {
          "applicability": "required"
        }
      }
    },
    {
      "id": "FS0-NR-010",
      "statement": "A Design statement identity SHALL NOT constitute a repository normative requirement identity.",
      "evaluation": {
        "conformance": {
          "applicability": "required"
        },
        "assurance": {
          "applicability": "required"
        }
      }
    },
    {
      "id": "FS0-NR-011",
      "statement": "Each declared Design Proposal dependency SHALL resolve before Planning acceptance.",
      "evaluation": {
        "conformance": {
          "applicability": "required"
        },
        "assurance": {
          "applicability": "none",
          "rationale": "The obligation is mechanically decidable under the accepted normative-statement contract."
        }
      }
    },
    {
      "id": "FS0-NR-012",
      "statement": "Each selected Design statement identity SHALL resolve before Planning acceptance.",
      "evaluation": {
        "conformance": {
          "applicability": "required"
        },
        "assurance": {
          "applicability": "none",
          "rationale": "The obligation is mechanically decidable under the accepted normative-statement contract."
        }
      }
    },
    {
      "id": "FS0-NR-013",
      "statement": "Planning SHALL select exactly one functional set for each Planning cycle.",
      "evaluation": {
        "conformance": {
          "applicability": "required"
        },
        "assurance": {
          "applicability": "required"
        }
      }
    },
    {
      "id": "FS0-NR-014",
      "statement": "Each selected functional set SHALL be manageable within one implementation cycle.",
      "evaluation": {
        "conformance": {
          "applicability": "required"
        },
        "assurance": {
          "applicability": "required"
        }
      }
    },
    {
      "id": "FS0-NR-015",
      "statement": "Each selected functional set SHALL provide one coherent end-to-end unit of functionality.",
      "evaluation": {
        "conformance": {
          "applicability": "required"
        },
        "assurance": {
          "applicability": "required"
        }
      }
    },
    {
      "id": "FS0-NR-016",
      "statement": "The initial functional set SHALL have the stable identity `FS0-CORE`.",
      "evaluation": {
        "conformance": {
          "applicability": "required"
        },
        "assurance": {
          "applicability": "none",
          "rationale": "The obligation is mechanically decidable under the accepted normative-statement contract."
        }
      }
    },
    {
      "id": "FS0-NR-017",
      "statement": "`FS0-CORE` SHALL occupy implementation order `000`.",
      "evaluation": {
        "conformance": {
          "applicability": "required"
        },
        "assurance": {
          "applicability": "none",
          "rationale": "The obligation is mechanically decidable under the accepted normative-statement contract."
        }
      }
    },
    {
      "id": "FS0-NR-018",
      "statement": "Each later functional set SHALL technically depend on `FS0-CORE` for operation.",
      "evaluation": {
        "conformance": {
          "applicability": "required"
        },
        "assurance": {
          "applicability": "required"
        }
      }
    },
    {
      "id": "FS0-NR-019",
      "statement": "Each functional-set directory SHALL contain `functional-set.json`.",
      "evaluation": {
        "conformance": {
          "applicability": "required"
        },
        "assurance": {
          "applicability": "none",
          "rationale": "The obligation is mechanically decidable under the accepted normative-statement contract."
        }
      }
    },
    {
      "id": "FS0-NR-020",
      "statement": "Each functional-set directory SHALL contain `plan.json`.",
      "evaluation": {
        "conformance": {
          "applicability": "required"
        },
        "assurance": {
          "applicability": "none",
          "rationale": "The obligation is mechanically decidable under the accepted normative-statement contract."
        }
      }
    },
    {
      "id": "FS0-NR-021",
      "statement": "`functional-set.json` SHALL identify the exact Design Proposal inputs selected for the functional set.",
      "evaluation": {
        "conformance": {
          "applicability": "required"
        },
        "assurance": {
          "applicability": "none",
          "rationale": "The obligation is mechanically decidable under the accepted normative-statement contract."
        }
      }
    },
    {
      "id": "FS0-NR-022",
      "statement": "`functional-set.json` SHALL identify the Design statement identities selected for the functional set.",
      "evaluation": {
        "conformance": {
          "applicability": "required"
        },
        "assurance": {
          "applicability": "none",
          "rationale": "The obligation is mechanically decidable under the accepted normative-statement contract."
        }
      }
    },
    {
      "id": "FS0-NR-023",
      "statement": "`functional-set.json` SHALL NOT contain Planning-distilled normative requirements.",
      "evaluation": {
        "conformance": {
          "applicability": "required"
        },
        "assurance": {
          "applicability": "none",
          "rationale": "The obligation is mechanically decidable under the accepted normative-statement contract."
        }
      }
    },
    {
      "id": "FS0-NR-024",
      "statement": "`functional-set.json` SHALL NOT contain implementation intent.",
      "evaluation": {
        "conformance": {
          "applicability": "required"
        },
        "assurance": {
          "applicability": "none",